id,screen_name,user_id,time,link,text,source,account_type,party,chamber,name,emotion_label,emotion_score,emotion_group
1346912146223886337,senatorhassan,946549322,2021-01-06 20:10:54+00:00,https://www.twitter.com/SenatorHassan/statuses/1346912146223886337,My staff and I are safe — we are now sheltering in place and will continue to follow law enforcement's guidance. Thank you to the Capitol Police for working to keep us all safe.,Twitter Web App,office,D,senate,Maggie Hassan,gratitude,0.9614353179931641,joy
1346958000754487299,repswalwell,942156122,2021-01-06 23:13:07+00:00,https://www.twitter.com/RepSwalwell/statuses/1346958000754487299,"Thank you to everyone who has checked in. I am safe and my staff are safe. I’m grateful to the men and women of the Capitol Police. Terrorists will not stop democracy. is going to be the next president. Soon, Congress will resume its duty of certifying the election.",Twitter for iPhone,office,D,house,Eric Swalwell,gratitude,0.9792821407318115,joy
1346899991558819841,repswalwell,942156122,2021-01-06 19:22:36+00:00,https://www.twitter.com/RepSwalwell/statuses/1346899991558819841,"As Representatives, we swear on oath to defend the Constitution against all enemies, foreign and domestic. Any elected official who does not denounce this full frontal assault on our democracy is assisting a coup attempt on the Capitol.",Twitter for iPhone,office,D,house,Eric Swalwell,neutral,0.6923086643218994,neutral
1346894822720868352,repswalwell,942156122,2021-01-06 19:02:04+00:00,https://www.twitter.com/RepSwalwell/statuses/1346894822720868352,"Nope. You caused this. You break it, you buy it. Thank you to Capitol Police for protecting the People's House.Protesters have a Constitutionally-protected right to be heard, but I urge them to remain peaceful.",Twitter for iPhone,office,D,house,Eric Swalwell,gratitude,0.8493784666061401,joy
1346918124956884999,mikekellypa,935368364,2021-01-06 20:34:40+00:00,https://www.twitter.com/MikeKellyPA/statuses/1346918124956884999,"We know there is a lot of anger over this election and what’s happening in America, but this is not who we are. We resolve our disputes peacefully under the rule of law. This must stop now. My staff and I are safe and thank the Capitol Police for their bravery.",Twitter for iPhone,office,R,house,Mike Kelly,gratitude,0.8410285711288452,joy
1346908036988870665,reprichhudson,935033864,2021-01-06 19:54:35+00:00,https://www.twitter.com/RepRichHudson/statuses/1346908036988870665,Thank you to all the who are on duty today and keeping us safe.,Twitter Web App,office,R,house,Richard Hudson,gratitude,0.9696927070617676,joy
1346904952896188422,reprichhudson,935033864,2021-01-06 19:42:19+00:00,https://www.twitter.com/RepRichHudson/statuses/1346904952896188422,"Violence will not change the outcome and is completely counter to this process. Capitol Police are honest, decent men and women whose only goal is to serve and protect the public.",Twitter Web App,office,R,house,Richard Hudson,neutral,0.3977283835411072,neutral
1346935671030743040,repdavidrouzer,834069080,2021-01-06 21:44:23+00:00,https://www.twitter.com/RepDavidRouzer/statuses/1346935671030743040,"2/2 This is not who we are as a nation. A vigorous debate and differences of opinion should never — ever — be an excuse for lawlessness and violence. Praying for our Capitol Police, other law enforcement personnel and those injured today.",Twitter for iPhone,office,R,house,David Rouzer,caring,0.7743465304374695,moral
1346935670191902721,repdavidrouzer,834069080,2021-01-06 21:44:23+00:00,https://www.twitter.com/RepDavidRouzer/statuses/1346935670191902721,1/2 Thank you to all who have reached out. My staff and I are safe. The lawlessness witnessed at the Capitol today is despicable and should be condemned in the strongest possible way.,Twitter for iPhone,office,R,house,David Rouzer,gratitude,0.915605902671814,joy
1346969148941852677,repdannydavis,789244177,2021-01-06 23:57:25+00:00,https://www.twitter.com/RepDannyDavis/statuses/1346969148941852677,I'm in!!!,Twitter Web App,office,D,house,Danny K. Davis,excitement,0.38784709572792053,joy
1346969113529262080,repdannydavis,789244177,2021-01-06 23:57:16+00:00,https://www.twitter.com/RepDannyDavis/statuses/1346969113529262080,Thank you for your prayers - the is beyond 3rd World ridiculous.,Twitter Web App,office,D,house,Danny K. Davis,gratitude,0.9871219992637634,joy
1346967951262572545,repdannydavis,789244177,2021-01-06 23:52:39+00:00,https://www.twitter.com/RepDannyDavis/statuses/1346967951262572545,done,Twitter Web App,office,D,house,Danny K. Davis,neutral,0.9601183533668518,neutral
1346967920392495105,repdannydavis,789244177,2021-01-06 23:52:32+00:00,https://www.twitter.com/RepDannyDavis/statuses/1346967920392495105,done,Twitter Web App,office,D,house,Danny K. Davis,neutral,0.9601183533668518,neutral
1346960733129629699,repdannydavis,789244177,2021-01-06 23:23:58+00:00,https://www.twitter.com/RepDannyDavis/statuses/1346960733129629699,Rep. Davis Statement on the Capitol Events,Twitter Web App,office,D,house,Danny K. Davis,neutral,0.9679190516471863,neutral
1346941777878671378,repdannydavis,789244177,2021-01-06 22:08:39+00:00,https://www.twitter.com/RepDannyDavis/statuses/1346941777878671378,so many questions.... THEY JUST LET THEM IN ?????? yeah i’m logging off,Twitter Web App,office,D,house,Danny K. Davis,confusion,0.5588897466659546,surprise
1346937407497666560,repdannydavis,789244177,2021-01-06 21:51:17+00:00,https://www.twitter.com/AgentTinsley/statuses/1346915617295585280,RT One of these was called unpatriotic and the other is being called a peaceful protest by Fox News today. (NBC/Getty),Twitter Web App,office,D,house,Danny K. Davis,neutral,0.9362943768501282,neutral
1346921414167728129,repdannydavis,789244177,2021-01-06 20:47:44+00:00,https://www.twitter.com/RepDannyDavis/statuses/1346921414167728129,I am safe thanks for asking,Twitter Web App,office,D,house,Danny K. Davis,gratitude,0.9718673825263977,joy
1346919282182135809,repdannydavis,789244177,2021-01-06 20:39:16+00:00,https://www.twitter.com/RepDannyDavis/statuses/1346919282182135809,AMERICA.... The Senate,Twitter Web App,office,D,house,Danny K. Davis,neutral,0.9665012955665588,neutral
1346906631523676162,repdannydavis,789244177,2021-01-06 19:48:59+00:00,https://www.twitter.com/RepDannyDavis/statuses/1346906631523676162,I honestly have no idea,Twitter Web App,office,D,house,Danny K. Davis,confusion,0.9346778988838196,surprise
1346903663801937926,repdannydavis,789244177,2021-01-06 19:37:12+00:00,https://www.twitter.com/RepDannyDavis/statuses/1346903663801937926,Today is a complete and utter embarrassment.,Twitter Web App,office,D,house,Danny K. Davis,embarrassment,0.7998846769332886,moral
1346943806051147778,repcartwright,776664410,2021-01-06 22:16:43+00:00,https://www.twitter.com/RepCartwright/statuses/1346943806051147778,Just want to mark myself as safe. Couple of dicey moments this afternoon for sure but my staff and I are safe. Great thanks for our terrific Capitol Police.,Twitter Web App,office,D,house,Matt Cartwright,gratitude,0.8951852321624756,joy
1346937923359408128,mikecrapo,600463589,2021-01-06 21:53:20+00:00,https://www.twitter.com/Mike_Pence/statuses/1346918219991420928,RT The violence and destruction taking place at the US Capitol Must Stop and it Must Stop Now. Anyone involved must respect Law Enforcement officers and immediately leave the building.,Twitter Web App,office,R,senate,Mike Crapo,anger,0.4859893023967743,anger
1346933045937389570,mikecrapo,600463589,2021-01-06 21:33:57+00:00,https://www.twitter.com/CongMikeSimpson/statuses/1346911995455422465,RT We have a constitutional right to peaceful protests but the clashes with police and destruction of property must stop now. We can disagree in a better way.,Twitter Web App,office,R,senate,Mike Crapo,approval,0.3915107548236847,joy
1346933002819969027,mikecrapo,600463589,2021-01-06 21:33:47+00:00,https://www.twitter.com/SenatorRisch/statuses/1346930384953618438,RT This nonsense and violence needs to stop now.,Twitter Web App,office,R,senate,Mike Crapo,annoyance,0.517717719078064,anger
1346932617879416835,mikecrapo,600463589,2021-01-06 21:32:15+00:00,https://www.twitter.com/GovernorLittle/statuses/1346931678921388035,"RT The violence at the U.S. Capitol is inexcusable and must stop. In Idaho, we uphold the tenets of the First Amendment, but what we are seeing in D.C. is not peaceful expression. Idahoans stand up for law enforcement and respect the rule of law.",Twitter Web App,office,R,senate,Mike Crapo,approval,0.34473714232444763,joy
1346929934753804289,mikecrapo,600463589,2021-01-06 21:21:35+00:00,https://www.twitter.com/SenateGOP/statuses/1346928269602529282,RT This is not who we are.This is not what we fight for.This is not American.This must stop. Now.,Twitter Web App,office,R,senate,Mike Crapo,disapproval,0.7157449126243591,anger
1346926521500446724,mikecrapo,600463589,2021-01-06 21:08:02+00:00,https://www.twitter.com/MikeCrapo/statuses/1346926521500446724,"The violence we are seeing at the Capitol is wholly unacceptable. It must be stopped immediately and all perpetrators prosecuted to the fullest extent of the law. God bless the Capitol Police, National Guard and other law enforcement on the scene here and at other sites.",Twitter Web App,office,R,senate,Mike Crapo,caring,0.5911354422569275,moral
1346923012327526402,repdlamborn,584012853,2021-01-06 20:54:05+00:00,https://www.twitter.com/Mike_Pence/statuses/1346918219991420928,RT The violence and destruction taking place at the US Capitol Must Stop and it Must Stop Now. Anyone involved must respect Law Enforcement officers and immediately leave the building.,Twitter Web App,office,R,house,Doug Lamborn,anger,0.4859893023967743,anger
1346916133589446664,repdlamborn,584012853,2021-01-06 20:26:45+00:00,https://www.twitter.com/RepDLamborn/statuses/1346916133589446664,"My staff and I are safe. I strongly condemn those individuals that have chosen to incite violence and have put our law enforcement in harm's way. Today is supposed to be a day of constitutional debate, not violence. This is not who we are as Americans.",Twitter Web App,office,R,house,Doug Lamborn,approval,0.34998226165771484,joy
1346906317773021188,repdlamborn,584012853,2021-01-06 19:47:45+00:00,https://www.twitter.com/GOPLeader/statuses/1346893810115227654,"RT Thank you to Capitol Police for protecting the People's House.Protesters have a Constitutionally-protected right to be heard, but I urge them to remain peaceful.",Twitter Web App,office,R,house,Doug Lamborn,gratitude,0.9739907383918762,joy
1346938637225762818,repmarcykaptur,581141508,2021-01-06 21:56:10+00:00,https://www.twitter.com/RepMarcyKaptur/statuses/1346938637225762818,Such lawless behavior will not be allowed to prevent our constitutional mandate. I look forward to Congress reconvening and completing its work to certify America’s vote and to doing the work we must to heal this nation.,Twitter Web App,office,D,house,Marcy Kaptur,optimism,0.7049108147621155,joy
1346938636298817536,repmarcykaptur,581141508,2021-01-06 21:56:10+00:00,https://www.twitter.com/RepMarcyKaptur/statuses/1346938636298817536,"The attack on the U.S. Capitol today is an assault on democracy, decency and our Constitution. Those who have stoked and perpetuated this violence must be held accountable to fullest extent of the law.",Twitter Web App,office,D,house,Marcy Kaptur,anger,0.4374563694000244,anger
1346938635229163520,repmarcykaptur,581141508,2021-01-06 21:56:10+00:00,https://www.twitter.com/RepMarcyKaptur/statuses/1346938635229163520,This is a horrific day for American democracy and liberty. My deepest gratitude goes out to the selfless men and women of the Capitol Police for keeping my colleagues and our public servants safe.,Twitter Web App,office,D,house,Marcy Kaptur,gratitude,0.9528539776802063,joy
1346907425316737027,repmarcykaptur,581141508,2021-01-06 19:52:09+00:00,https://www.twitter.com/RepMarcyKaptur/statuses/1346907425316737027,"This, all of this, is on Donald Trump. His rhetoric and actions to incite such mayhem for political gain is reprehensible and dangerous. This is not our America.",Twitter Web App,office,D,house,Marcy Kaptur,disapproval,0.44386526942253113,anger
1346958286172676100,repdean,567508925,2021-01-06 23:14:15+00:00,https://www.twitter.com/RepDean/statuses/1346958286172676100,Look what this President has brought our country to — Trump must resign or be removed.,Twitter for iPhone,office,D,house,Madeleine Dean,neutral,0.45040473341941833,neutral
1346908100339625986,repdean,567508925,2021-01-06 19:54:50+00:00,https://www.twitter.com/RepDean/statuses/1346908100339625986,UPDATE: I’ve been evacuated and I am am finding safe location. Please pray for peace in this nation.,Twitter for iPhone,office,D,house,Madeleine Dean,caring,0.8783509135246277,moral
1346901147437707265,repdean,567508925,2021-01-06 19:27:12+00:00,https://www.twitter.com/RepDean/statuses/1346901147437707265,Just wanted to let everyone know that I am safe on the House floor. Deeply saddened by the scene outside the Capitol.,Twitter Web App,office,D,house,Madeleine Dean,sadness,0.7754186987876892,sadness
1346946014071160832,repbonamici,558769636,2021-01-06 22:25:29+00:00,https://www.twitter.com/Oregonian/statuses/1346940731005390850,"RT Members of Oregon’s congressional delegation expressed shock and disbelief Wednesday as a mob of violent protestors poured into the U.S. Capitol, forcing Congress and the vice president to flee.",TweetDeck,office,D,house,Suzanne Bonamici,surprise,0.595717191696167,surprise
1346928808604168193,repbonamici,558769636,2021-01-06 21:17:07+00:00,https://www.twitter.com/RepBonamici/statuses/1346928808604168193,This is a sad and dangerous day for our country and democracy.,Twitter Web App,office,D,house,Suzanne Bonamici,sadness,0.8297447562217712,sadness
1346928807375155208,repbonamici,558769636,2021-01-06 21:17:07+00:00,https://www.twitter.com/RepBonamici/statuses/1346928807375155208,"I am continuing to shelter in place. Trump repeatedly incited this act of domestic terrorism, including encouraging armed protestors this very morning, steps from the Capitol. He must tell his supporters to leave the Capitol immediately before more people are hurt.",Twitter Web App,office,D,house,Suzanne Bonamici,neutral,0.771234929561615,neutral
1346911855625658373,repbonamici,558769636,2021-01-06 20:09:45+00:00,https://www.twitter.com/TigardTimes/statuses/1346911412858146823,"RT Rep. Suzanne Bonamici, others, describe scary moments as Trump supporters storm the building and Washington, D.C., goes into curfew.",TweetDeck,office,D,house,Suzanne Bonamici,neutral,0.7009046077728271,neutral
1346901775631200260,repbonamici,558769636,2021-01-06 19:29:42+00:00,https://www.twitter.com/RepBonamici/statuses/1346901775631200260,I am currently sheltering in place and safe.,TweetDeck,office,D,house,Suzanne Bonamici,caring,0.6355863809585571,moral
1346925831575244804,rephalrogers,550401754,2021-01-06 21:05:17+00:00,https://www.twitter.com/RepHalRogers/statuses/1346925831575244804,"I adamantly denounce the violence taking place in Washington, and threatening the lives of innocent individuals. We must maintain law and order in this country.",Twitter for iPhone,office,R,house,Hal Rogers,approval,0.30208298563957214,joy
1346925830153367557,rephalrogers,550401754,2021-01-06 21:05:17+00:00,https://www.twitter.com/RepHalRogers/statuses/1346925830153367557,"Violence is never the answer. As my staff and I safely shelter in place, I am appalled to see Americans storming the Capitol in an effort to disrupt our very foundation of democracy. I believe every voice should be heard, but violent methods fall on deaf ears.",Twitter for iPhone,office,R,house,Hal Rogers,fear,0.2553761899471283,fear
1346911228128501769,repbradwenstrup,518644221,2021-01-06 20:07:15+00:00,https://www.twitter.com/RepBradWenstrup/statuses/1346911228128501769,"I condemn these actions and stand behind Capitol Police and our law enforcement in restoring order. Again, the violence must stop. 2/2",Twitter Web App,office,R,house,Brad Wenstrup,approval,0.5349971652030945,joy
1346911226312343552,repbradwenstrup,518644221,2021-01-06 20:07:15+00:00,https://www.twitter.com/RepBradWenstrup/statuses/1346911226312343552,"This violence must stop. The criminals who have broken into the U.S. Capitol, injured law enforcement, and disrupted the constitutional process are not patriots. No matter what flag one is carrying, people violating the law need to be held accountable. 1/2",Twitter Web App,office,R,house,Brad Wenstrup,anger,0.4007005989551544,anger
1346900415577776129,repbradwenstrup,518644221,2021-01-06 19:24:17+00:00,https://www.twitter.com/RepBradWenstrup/statuses/1346900415577776129,"Any violence or threat of violence is completely unacceptable.Americans can exercise their First Amendment rights, but must do so peacefully.",Twitter for iPhone,office,R,house,Brad Wenstrup,disapproval,0.7663582563400269,anger
1346965048690757634,bettymccollum04,516880804,2021-01-06 23:41:07+00:00,https://www.twitter.com/maxnesterak/statuses/1346958725093867520,"RT Rep. McCollum on her R colleagues who planned to challenge the electoral results: ""I hope they have realized the consequences of spreading the President's lies and what it has done to our nation's Capitol and our standing around the world. They've made a mockery of us.""",Twitter Web App,office,D,house,Betty McCollum,optimism,0.43311357498168945,joy
1346965042424590337,bettymccollum04,516880804,2021-01-06 23:41:06+00:00,https://www.twitter.com/maxnesterak/statuses/1346955171402633219,"RT Spoke with , who says the VP and cabinet should invoke the 25th amendment and remove Trump from office: ""This man is dangerous. He has until January 20 to have the title of President of the United States, and I believe that should be taken away from him.”",Twitter Web App,office,D,house,Betty McCollum,neutral,0.8775419592857361,neutral
1346954165889728519,bettymccollum04,516880804,2021-01-06 22:57:53+00:00,https://www.twitter.com/BettyMcCollum04/statuses/1346954165889728519,"Now that Democrats will control the House, Senate, and White House, we will restore the rule of law in our country and hold the perpetrators of this attempted coup accountable.",Twitter Web App,office,D,house,Betty McCollum,approval,0.5349457263946533,joy
1346954165134745600,bettymccollum04,516880804,2021-01-06 22:57:52+00:00,https://www.twitter.com/BettyMcCollum04/statuses/1346954165134745600,"For months, Republicans’ conspiracy theories & lies have poured gas on the fire of insurrection – and now Trump terrorists have attacked police and broken into the U.S. Capitol in an attempted coup. Republicans who have enabled this violence must be held accountable.",Twitter Web App,office,D,house,Betty McCollum,neutral,0.3516519367694855,neutral
1346926125612728320,bettymccollum04,516880804,2021-01-06 21:06:27+00:00,https://www.twitter.com/BettyMcCollum04/statuses/1346926125612728320,Every American who values our democracy needs to stand up now for the U.S. Constitution and the rule of law.,Twitter Web App,office,D,house,Betty McCollum,neutral,0.5134938955307007,neutral
1346926124757118981,bettymccollum04,516880804,2021-01-06 21:06:27+00:00,https://www.twitter.com/BettyMcCollum04/statuses/1346926124757118981,"At this moment, with the breach of the U.S. Capitol and the betrayal of our democracy by the White House, we do not have a government that is functioning properly. Our country is in grave danger – both internally and from our adversaries beyond our shores.",Twitter Web App,office,D,house,Betty McCollum,disappointment,0.2977454960346222,sadness
1346906056933388289,bettymccollum04,516880804,2021-01-06 19:46:42+00:00,https://www.twitter.com/BettyMcCollum04/statuses/1346906056933388289,"My staff & I are safe & following protocols, but I am very concerned for the safety of my colleagues, other congressional staff, & US Capitol Police. This is a situation provoked by President Trump & Republicans that is rapidly deteriorating. It needs to end quickly & peacefully.",Twitter Web App,office,D,house,Betty McCollum,caring,0.8880829811096191,moral
1346927680000815110,senatortester,515822213,2021-01-06 21:12:38+00:00,https://www.twitter.com/SenatorTester/statuses/1346927680000815110,Thank you for your concerns. My staff and I are safe and secure. The violent actions we are seeing today at our nation’s Capitol are an affront to our democracy and have no place in America.,Twitter Web App,office,D,senate,Jon Tester,gratitude,0.8537552356719971,joy
1346897536888537092,senatortester,515822213,2021-01-06 19:12:51+00:00,https://www.twitter.com/SenatorTester/statuses/1346897536888537092,I join my Republican and Democratic colleagues in condemning this despicable and dangerous attack on our democracy. The election is over—and the time for baseless objections that do nothing but undermine our Constitution is over too. My full statement ⬇️,Twitter Web App,office,D,senate,Jon Tester,approval,0.43123069405555725,joy
1346916072373551106,senjackreed,486694111,2021-01-06 20:26:30+00:00,https://www.twitter.com/SenJackReed/statuses/1346916072373551106,"I'm safe & determined to defend our democracy from these heinous attacks. This violent mob, incited by Trump, breached the Capitol, but our work continues & our principles endure. They will not destroy our democracy, undo the election, or subvert the will of the American People!",Twitter Web App,office,D,senate,Jack Reed,caring,0.34217536449432373,moral
1346919904679702531,reproybalallard,479872233,2021-01-06 20:41:44+00:00,https://www.twitter.com/RepRoybalAllard/statuses/1346919904679702531,Es un día trágico en la historia de EE.UU. cuando vemos a terroristas domésticos que apoyan a Trump rodear y violar el edificio del Capitolio. Mi personal y yo estamos seguros y salvo gracias a la Policía del Capitolio. Rezo por la seguridad de todos y el alma de nuestra nación.,Twitter Web App,office,D,house,Lucille Roybal-Allard,neutral,0.9223200678825378,neutral
1346918562246615040,reproybalallard,479872233,2021-01-06 20:36:24+00:00,https://www.twitter.com/RepRoybalAllard/statuses/1346918562246615040,It's a tragic day in American history as we see Trump-supporting domestic terrorists surround & breach the Capitol building. My staff & I are secured & safe thanks to the courageous actions of the Capitol Police. Praying for the safety of everybody & the very soul of our nation.,Twitter Web App,office,D,house,Lucille Roybal-Allard,gratitude,0.9053441882133484,joy
1346968107890462731,repjeffries,467823431,2021-01-06 23:53:17+00:00,https://www.twitter.com/RepJeffries/statuses/1346968107890462731,A mob of Trump supporters stormed the Capitol in a treasonous insurrection.This was a violent attack on our democracy.Fueled by sycophantic members of the House and Senate.They must also be held accountable.,Twitter Web App,office,D,house,Hakeem Jeffries,annoyance,0.3242839574813843,anger
1346928998295678976,repjeffries,467823431,2021-01-06 21:17:52+00:00,https://www.twitter.com/RepJeffries/statuses/1346928998295678976,Insurrection is a serious crime.Prosecute them ALL.,Twitter Web App,office,D,house,Hakeem Jeffries,anger,0.4282281696796417,anger
1346904618475905026,repjeffries,467823431,2021-01-06 19:40:59+00:00,https://www.twitter.com/RepJeffries/statuses/1346904618475905026,Violent Trump supporters have stormed the Capitol.We’re on lockdown right now in the Chamber.Blood will be on the hands of those perpetrating the big lie that Trump won.,Twitter Web App,office,D,house,Hakeem Jeffries,neutral,0.5149156451225281,neutral
1346955933881085954,repcicilline,462143773,2021-01-06 23:04:54+00:00,https://www.twitter.com/MSNBC/statuses/1346953501541191680,"RT Rep. Cicilline: ""This is outrageous, and the president caused it. We should impeach and convict him tomorrow.""",Twitter Web App,office,D,house,David Cicilline,neutral,0.5277993083000183,neutral
1346919605923672066,repcicilline,462143773,2021-01-06 20:40:33+00:00,https://www.twitter.com/davidcicilline/statuses/1346916122180919296,"RT This is outrageous, and the president caused it. We should impeach and convict him tomorrow.",Twitter Web App,office,D,house,David Cicilline,annoyance,0.4832921326160431,anger
1346914343716319249,repcicilline,462143773,2021-01-06 20:19:38+00:00,https://www.twitter.com/davidcicilline/statuses/1346914094822137863,RT My staff and I are safe. I pray for the safety of the men and women of law enforcement. Say a prayer for our country.,Twitter Web App,office,D,house,David Cicilline,caring,0.9245122075080872,moral
1346914486414880768,reprichardneal,442824717,2021-01-06 20:20:12+00:00,https://www.twitter.com/RepRichardNeal/statuses/1346914486414880768,I am currently in the Capitol complex sheltering in place. We are following Capitol Police orders and are thankful that they are keeping us safe during this violence.,Twitter for iPhone,office,D,house,Richard Neal,gratitude,0.9182872176170349,joy
1346914342235742208,gkbutterfield,432676344,2021-01-06 20:19:38+00:00,https://www.twitter.com/GKButterfield/statuses/1346914342235742208,Butterfield statement concerning U.S. Capitol: “I am safe and monitoring the violent uprising that is ongoing at the U.S. Capitol complex. Please pray for our country.”,Twitter for iPhone,office,D,house,G.K. Butterfield,caring,0.9024808406829834,moral
1346967587905826818,repricklarsen,404132211,2021-01-06 23:51:13+00:00,https://www.twitter.com/RepRickLarsen/statuses/1346967587905826818,I agree with Bernie Sanders on this one,Twitter for Android,office,D,house,Rick Larsen,approval,0.9093676209449768,joy
