id,screen_name,user_id,time,link,text,source,account_type,party,chamber,name,emotion_label,emotion_score,emotion_group
1346969310686707714,repbilljohnson,211530910,2021-01-06 23:58:03+00:00,https://www.twitter.com/RepBillJohnson/statuses/1346969310686707714,"...government buildings for the last 6 months, this lawlessness is wrong and should be universally condemned. We’re all Americans, and we’re better than this. I thank all the men& women of the U.S. Capitol Police+other law enforcement agencies who brought help for their service.",Twitter for iPhone,office,R,house,Bill Johnson,gratitude,0.7399588227272034,joy
1346969309336252417,repbilljohnson,211530910,2021-01-06 23:58:03+00:00,https://www.twitter.com/RepBillJohnson/statuses/1346969309336252417,I swore an oath to protect the Constitution and the rule of law. I take that oath seriously. Whether it was the violent thugs who fought with police and stormed the U.S. Capitol building today or the violent thugs of Antifa and BLM who've been assaulting police and attacking...,Twitter for iPhone,office,R,house,Bill Johnson,neutral,0.4621889889240265,neutral
1346925969089589248,repbilljohnson,211530910,2021-01-06 21:05:50+00:00,https://www.twitter.com/RepBillJohnson/statuses/1346925969089589248,I’m shocked and dismayed by the violence here in the Capitol. This is not the way Americans solve our problems.,Twitter for iPhone,office,R,house,Bill Johnson,surprise,0.6353697180747986,surprise
1346953969529192449,repstevestivers,211420609,2021-01-06 22:57:06+00:00,https://www.twitter.com/RepSteveStivers/statuses/1346953969529192449,Enough. This isn’t the way democracy works. This isn’t the way our republic functions. It’s un-American. The rioters who’ve destroyed federal property & harmed law enforcement officers must be brought to justice. Everyone must disperse & go home. Thank you to all police officers.,Twitter for iPhone,office,R,house,Steve Stivers,disapproval,0.42082729935646057,anger
1346920823148437504,repstevestivers,211420609,2021-01-06 20:45:23+00:00,https://www.twitter.com/RepSteveStivers/statuses/1346920823148437504,Many of those protesting today are carrying flags in support of the Thin Blue Line and law enforcement - I’m calling on everyone at the Capitol to obey the law and follow all instructions given by Capitol police and other law enforcement.,Twitter for iPhone,office,R,house,Steve Stivers,approval,0.5498707890510559,joy
1346918855713509376,repstevestivers,211420609,2021-01-06 20:37:34+00:00,https://www.twitter.com/RepSteveStivers/statuses/1346918855713509376,Protestors have a right to be heard – a right that I’ve fought overseas for - but there is a difference between protesting and rioting. Destruction and lawlessness are not acceptable.,Twitter for iPhone,office,R,house,Steve Stivers,neutral,0.38026031851768494,neutral
1346953461263425538,repcuellar,210926192,2021-01-06 22:55:05+00:00,https://www.twitter.com/RepCuellar/statuses/1346953461263425538,My staff and I currently remain safe. This is a sad day for our country. I am praying for the violence to end and for our democracy. I want to thank the brave Capitol Police for protecting us as we remain in lockdown.,Twitter for iPhone,office,D,house,Henry Cuellar,gratitude,0.7136264443397522,joy
1346935923565592577,senjohnbarrasso,202206694,2021-01-06 21:45:23+00:00,https://www.twitter.com/SenJohnBarrasso/statuses/1346935923565592577,This violence and destruction have no place in our republic. It must end now.,Twitter Web App,office,R,senate,John Barrasso,disapproval,0.4610457718372345,anger
1346969659816501248,repandrecarson,199325935,2021-01-06 23:59:27+00:00,https://www.twitter.com/RepAndreCarson/statuses/1346969659816501248,"I said it then and I'll say it again now -- what happened at the Capitol today is domestic terrorism. It's the greatest threat to our national security, and our own President is encouraging it. Make no mistake, the tragedy in #Charlottesville is domestic terrorism. We must condemn it. We must confront it.",Twitter Web App,office,D,house,Andre Carson,approval,0.2607937753200531,joy
1346961780820619267,repandrecarson,199325935,2021-01-06 23:28:08+00:00,https://www.twitter.com/RepAndreCarson/statuses/1346961780820619267,I'm currently safe. What we are witnessing today is domestic terrorism and armed insurrection. President Trump has fanned these flames. He and all of his allies must immediately condemn this violence and end their effort to overturn our government and the election results.,Twitter Web App,office,D,house,Andre Carson,neutral,0.43496793508529663,neutral
1346928153277718531,sencapito,193794406,2021-01-06 21:14:31+00:00,https://www.twitter.com/SenCapito/statuses/1346928153277718531,This is the United States of America. This needs to stop right now. We don’t do this. It’s not who we are.,Twitter for iPhone,office,R,senate,Shelley Moore Capito,disapproval,0.613120973110199,anger
1346957230575394818,repjudychu,193732179,2021-01-06 23:10:03+00:00,https://www.twitter.com/RepJudyChu/statuses/1346957230575394818,"This is the result of years of a party telling you to hate, fear, and distrust your fellow Americans.",TweetDeck,office,D,house,Judy Chu,neutral,0.3598079979419708,neutral
1346933207292387330,repjudychu,193732179,2021-01-06 21:34:36+00:00,https://www.twitter.com/RepJudyChu/statuses/1346933207292387330,These are the same lies that inspired this violence in the first place. He is an ongoing threat to lives and our democracy. Praising and defending these rioters is inexcusable.,Twitter for iPhone,office,D,house,Judy Chu,approval,0.426220178604126,joy
1346914799804936199,repjudychu,193732179,2021-01-06 20:21:27+00:00,https://www.twitter.com/RepJudyChu/statuses/1346914799804936199,I am safe and in lockdown in the Capitol. The President and his supporters who are spreading lies about the election are responsible and they need to put an end to this incitement.,TweetDeck,office,D,house,Judy Chu,neutral,0.421872615814209,neutral
1346953789421592584,whipclyburn,188019606,2021-01-06 22:56:23+00:00,https://www.twitter.com/WhipClyburn/statuses/1346953789421592584,This authoritarian menace will not succeed in his attempts to overthrow our democratically elected government. I am praying for the safety and security of the public servants who are dedicated to making this country a “more perfect union.”,Twitter for iPhone,office,D,house,Jim Clyburn,caring,0.8923913240432739,moral
1346953787945189381,whipclyburn,188019606,2021-01-06 22:56:22+00:00,https://www.twitter.com/WhipClyburn/statuses/1346953787945189381,"I have faced violent hatred before. I was not deterred then, and I will not be deterred now. Tonight, Congress will continue the business of certifying the electoral college votes.",Twitter for iPhone,office,D,house,Jim Clyburn,neutral,0.40337392687797546,neutral
1346962929984430080,timkaine,172858784,2021-01-06 23:32:42+00:00,https://www.twitter.com/timkaine/statuses/1346962929984430080,"Not since the Burning of Washington by the British during the War of 1812 has the Capitol been attacked. The violence we saw today was an anti-American, anti-democratic assault on our nation. All must condemn it in the strongest of terms.",Twitter for iPhone,office,D,senate,Tim Kaine,neutral,0.26316210627555847,neutral
1346935400267452429,timkaine,172858784,2021-01-06 21:43:18+00:00,https://www.twitter.com/timkaine/statuses/1346935400267452429,"My staff and I are safe right now—following the instructions of Capitol Police and praying for the safety of Capitol workers, members of the press, and all here in Washington today. This violence must end now.",Twitter Web App,office,D,senate,Tim Kaine,caring,0.8825544714927673,moral
1346919162627678211,senbobcasey,171598736,2021-01-06 20:38:47+00:00,https://www.twitter.com/SenBobCasey/statuses/1346919162627678211,Update from Casey staff: Senator Casey was the only member of our team in the Capitol complex today. He is safe and taking direction from the United States Capitol Police.,Twitter Web App,office,D,senate,Bob Casey Jr.,neutral,0.5413073897361755,neutral
1346966769936773126,nydiavelazquez,164369297,2021-01-06 23:47:58+00:00,https://www.twitter.com/NydiaVelazquez/statuses/1346966769936773126,"., great idea. Count me in as a co-sponsor. I believe the Republican members of Congress who have incited this domestic terror attack through their attempts to overturn the election must face consequences. They have broken their sacred Oath of Office. I will be introducing a resolution calling for their expulsion.",Twitter Web App,office,D,house,Nydia Velazquez,admiration,0.732433021068573,joy
1346962784601468930,nydiavelazquez,164369297,2021-01-06 23:32:07+00:00,https://www.twitter.com/NydiaVelazquez/statuses/1346962784601468930,"Thank you to all who have reached out about the safety of myself, my staff, and everyone sheltering in place at the Capitol. Today, America’s highest ideals were shattered by a President who incited an act of domestic terrorism. We will certify the election when it is safe.",Twitter Web App,office,D,house,Nydia Velazquez,gratitude,0.9741390943527222,joy
1346904721320271874,nydiavelazquez,164369297,2021-01-06 19:41:24+00:00,https://www.twitter.com/NydiaVelazquez/statuses/1346904721320271874,The Capitol is on lockdown and we will continue to follow all public safety alerts.,Twitter Web App,office,D,house,Nydia Velazquez,neutral,0.37691912055015564,neutral
1346901597121638407,nydiavelazquez,164369297,2021-01-06 19:28:59+00:00,https://www.twitter.com/NydiaVelazquez/statuses/1346901597121638407,"After being in the House chamber to certify the results of a fair and free election, I am now sheltering in place. The President and every single Republican who incited and encouraged this behavior must denounce it immediately.",Twitter Web App,office,D,house,Nydia Velazquez,neutral,0.7677693963050842,neutral
1346918856242196496,repcleaver,163570705,2021-01-06 20:37:34+00:00,https://www.twitter.com/repcleaver/statuses/1346918856242196496,I am currently locked down in a safe and secure location. The country that I am seeing on television is unrecognizable to me. I will continue to pray for the safety of my colleagues and the Capitol Police Officers.,Twitter Web App,office,D,house,Emanuel Cleaver,caring,0.9153254628181458,moral
1346962377401536512,repcohen,162069635,2021-01-06 23:30:30+00:00,https://www.twitter.com/RepCohen/statuses/1346962377401536512,Caligula speaks,Twitter for iPad,office,D,house,Steve Cohen,neutral,0.968542218208313,neutral
1346956793704927234,repcohen,162069635,2021-01-06 23:08:19+00:00,https://www.twitter.com/RepCohen/statuses/1346956793704927234,Now The criminals have left And now they’ll get juiced up. Rednecks on bourbon and beer. Expect more destruction rioting and violence tonight,Twitter for iPad,office,D,house,Steve Cohen,neutral,0.6670197248458862,neutral
1346955269515825153,repcohen,162069635,2021-01-06 23:02:16+00:00,https://www.twitter.com/RepCohen/statuses/1346955269515825153,I must say what I’ve been thinking. If these criminals were black There would have been bullets tear gas and there would’ve been arrests and there would’ve been confrontations. For some reason these white rednecks got away with doing what they wanted to and went into the night,Twitter for iPhone,office,D,house,Steve Cohen,neutral,0.5227317214012146,neutral
1346945885792591874,repcohen,162069635,2021-01-06 22:24:58+00:00,https://www.twitter.com/RepCohen/statuses/1346945885792591874,"I’ve been foreseeing this for months. Post was last week. Trump has been egging this on for months. And he won’t stop. He is not acting as President of the United States he’s acting as a sick narcissistic hurt and wounded loser.Not putting America first putting himself first. Sad January 6 will be contentious, let it not be violent as well. Let the #Constitution operate as intended in what is supposed to be a process not a policy day on the Hill. #ElectoralCollege",Twitter for iPhone,office,D,house,Steve Cohen,sadness,0.5095507502555847,sadness
1346944540582825989,repcohen,162069635,2021-01-06 22:19:38+00:00,https://www.twitter.com/RepCohen/statuses/1346775789124128768,RT 14 more days!,Twitter for iPhone,office,D,house,Steve Cohen,neutral,0.8602652549743652,neutral
1346920357966577664,repcohen,162069635,2021-01-06 20:43:32+00:00,https://www.twitter.com/RepCohen/statuses/1346920357966577664,"Russia,if you are reading this,come and take your President home!",Twitter for iPad,office,D,house,Steve Cohen,neutral,0.9641128182411194,neutral
1346912800153735169,repcohen,162069635,2021-01-06 20:13:30+00:00,https://www.twitter.com/RepCohen/statuses/1346912800153735169,This is now a thirld world country led by a tin-pot dictator,Twitter for iPad,office,D,house,Steve Cohen,neutral,0.7035521864891052,neutral
1346904332856422403,repcohen,162069635,2021-01-06 19:39:51+00:00,https://www.twitter.com/RepCohen/statuses/1346904332856422403,Gas mask on#.getting scary,Twitter for iPad,office,D,house,Steve Cohen,fear,0.8446520566940308,fear
1346900603616829440,repcohen,162069635,2021-01-06 19:25:02+00:00,https://www.twitter.com/RepCohen/statuses/1346900603616829440,Where is Generalissimo Trump?Call off your revolutionary are at war with America !#25thAmendment,Twitter for iPad,office,D,house,Steve Cohen,neutral,0.7257773280143738,neutral
1346899287431651328,repcohen,162069635,2021-01-06 19:19:48+00:00,https://www.twitter.com/RepCohen/statuses/1346899287431651328,We are locked in the chamber as the hooligans have entered the Capitol,Twitter for iPad,office,D,house,Steve Cohen,neutral,0.8279775381088257,neutral
1346956451726573569,bobbyscott,161791703,2021-01-06 23:06:57+00:00,https://www.twitter.com/BobbyScott/statuses/1346956451726573569,My staff and I are safe.,Twitter for iPhone,office,D,house,Bobby Scott,caring,0.6981214284896851,moral
1346897028555689987,bobbyscott,161791703,2021-01-06 19:10:50+00:00,https://www.twitter.com/GovernorVA/statuses/1346894308037652481,RT Join us live for an update on #COVID19 vaccines in Virginia. WATCH HERE:,Twitter Web App,office,D,house,Bobby Scott,neutral,0.929450511932373,neutral
1346926371533180930,gracenapolitano,161411080,2021-01-06 21:07:26+00:00,https://www.twitter.com/gracenapolitano/statuses/1346926371533180930,Praying for the safety of the Capitol Police and our nation. Hopefully we will resume the process of democracy soon. My staff and I are safe.,Twitter for iPhone,office,D,house,Grace Napolitano,optimism,0.8726436495780945,joy
1346924301102956545,repalgreen,156333623,2021-01-06 20:59:12+00:00,https://www.twitter.com/RepAlGreen/statuses/1346924301102956545,"., for the love of country, STOP THIS MADNESS!",Twitter for iPhone,office,D,house,Al Green,anger,0.3759028911590576,anger
1346909100995702787,repalgreen,156333623,2021-01-06 19:58:48+00:00,https://www.twitter.com/RepAlGreen/statuses/1346909100995702787,. call on YOUR supporters to stop this madness that YOU incited! The Constitution intended a peaceful transfer of power. This is seditious. Only a dictator or would-be dictator would encourage this. Which are you?,Twitter for iPhone,office,D,house,Al Green,neutral,0.648356556892395,neutral
1346934114889453571,repdavideprice,155669457,2021-01-06 21:38:12+00:00,https://www.twitter.com/RepDavidEPrice/statuses/1346934114889453571,.: your video message isn't enough -- you incited this mob with your lies.,Twitter Web App,office,D,house,David Price,neutral,0.5415304899215698,neutral
1346905883561906186,repdavideprice,155669457,2021-01-06 19:46:01+00:00,https://www.twitter.com/RepDavidEPrice/statuses/1346905883561906186,"Pro-Trump protesters have stormed the U.S. Capitol building, forcing the House into recess. I am safe. Thank you to our brave Capitol Police officers who are actively working to protect Members, staff, and the press.",Twitter Web App,office,D,house,David Price,gratitude,0.9657049775123596,joy
1346968599152500736,replloyddoggett,153944899,2021-01-06 23:55:14+00:00,https://www.twitter.com/RepLloydDoggett/statuses/1346968599152500736,Here is the reaction to the violence of his supporters today at our Capitol by this lawless President whose enablers have permitted him to get away with anything—⚠️so big a lie that Twitter removed it.,Twitter for iPhone,office,D,house,Lloyd Doggett,neutral,0.7490242719650269,neutral
1346956654739292163,replloyddoggett,153944899,2021-01-06 23:07:46+00:00,https://www.twitter.com/RepLloydDoggett/statuses/1346911717440200715,"RT I am currently safe, but the Capitol has been breached and some colleagues are trapped there. President Trump has set loose violence on our Congress.",Twitter for iPhone,office,D,house,Lloyd Doggett,neutral,0.43122580647468567,neutral
1346938891325083659,replloyddoggett,153944899,2021-01-06 21:57:11+00:00,https://www.twitter.com/RepLloydDoggett/statuses/1346938891325083659,"We will overcome Trump and his Republican enablers, who would trade democracy for autocracy. But they have done lasting damage to our civic fabric and to America’s world standing.",Twitter for iPhone,office,D,house,Lloyd Doggett,disappointment,0.26515305042266846,sadness
1346938890058346499,replloyddoggett,153944899,2021-01-06 21:57:10+00:00,https://www.twitter.com/RepLloydDoggett/statuses/1346938890058346499,A shocking and tragic day for America—the natural outcome of Trump feeding his supporters a steady diet of lies and spurring them on to block formal recognition of his clear defeat. We will not throw out millions of legal votes or throw out our freedom.,Twitter for iPhone,office,D,house,Lloyd Doggett,surprise,0.2978381812572479,surprise
1346925657180221441,replloyddoggett,153944899,2021-01-06 21:04:35+00:00,https://www.twitter.com/RepLloydDoggett/statuses/1346925657180221441,"‘Remain peaceful'..? There is nothing peaceful about the dangerous mob that has breached our Capitol and endangers all working here, and especially our Capitol Police officers as the President sits back and comfortably watches the violence he's unleashed on his television screen.",Twitter Web App,office,D,house,Lloyd Doggett,neutral,0.4546031355857849,neutral
1346923825003442183,replloyddoggett,153944899,2021-01-06 20:57:19+00:00,https://www.twitter.com/RepLloydDoggett/statuses/1346923825003442183,This is what Trump’s chaos has devolved into: Members and staff are being advised to hide if you are in a public place on Capitol grounds.,Twitter for iPhone,office,D,house,Lloyd Doggett,neutral,0.8301028609275818,neutral
1346911717440200715,replloyddoggett,153944899,2021-01-06 20:09:12+00:00,https://www.twitter.com/RepLloydDoggett/statuses/1346911717440200715,"I am currently safe, but the Capitol has been breached and some colleagues are trapped there. President Trump has set loose violence on our Congress.",Twitter Web App,office,D,house,Lloyd Doggett,sadness,0.3905114531517029,sadness
1346906164215377925,replloyddoggett,153944899,2021-01-06 19:47:08+00:00,https://www.twitter.com/RepLloydDoggett/statuses/1346906164215377925,"Whenever you think Trump has set a new low, he goes lower. What shameful, seditious conduct by this loser!",Twitter Web App,office,D,house,Lloyd Doggett,embarrassment,0.3315661549568176,moral
1346905219880415235,replloyddoggett,153944899,2021-01-06 19:43:23+00:00,https://www.twitter.com/RepLloydDoggett/statuses/1346905219880415235,Video of Trump’s violent supporters storming our Capitol are now circling the globe. What a message to the world! We will overcome Trump and his Republican congressional cohorts but they have done real damage to our democracy and to America’s standing in the world.,Twitter Web App,office,D,house,Lloyd Doggett,disappointment,0.3622921407222748,sadness
1346904277059579904,replloyddoggett,153944899,2021-01-06 19:39:38+00:00,https://www.twitter.com/RepLloydDoggett/statuses/1346904277059579904,This is what Trump wanted—his violent supporters have stormed the Capitol. Trump’s sedition: determined to keep us from doing our constitutional duty.,Twitter Web App,office,D,house,Lloyd Doggett,neutral,0.6998631358146667,neutral
1346903360050520072,replloyddoggett,153944899,2021-01-06 19:35:59+00:00,https://www.twitter.com/RepLloydDoggett/statuses/1346903360050520072,Trump’s violent supporters have fought the police and forced our Capitol into lockdown as Trump tries to lockdown our democracy. Where are Trump’s tweets in support of law and order? Why isn’t Abbott “backing the blue?”,Twitter Web App,office,D,house,Lloyd Doggett,curiosity,0.5451290011405945,surprise
1346897952321785857,replloyddoggett,153944899,2021-01-06 19:14:30+00:00,https://www.twitter.com/RepLloydDoggett/statuses/1346897952321785857,"""I will not pretend such a vote would be a harmless protest gesture while relying on others to do the right thing. I will vote to respect the people's decision and defend our system of government.""",Twitter Web App,office,D,house,Lloyd Doggett,approval,0.7180307507514954,joy
1346897951315161091,replloyddoggett,153944899,2021-01-06 19:14:30+00:00,https://www.twitter.com/RepLloydDoggett/statuses/1346897951315161091,"McConnell says the democracy would enter a ""death spiral"" if this election was overturned. ""Congress will either overrule the voters, the states and the courts for the first time ever. Or honor the people's decision.""",Twitter Web App,office,D,house,Lloyd Doggett,neutral,0.823402464389801,neutral
1346897950132342787,replloyddoggett,153944899,2021-01-06 19:14:30+00:00,https://www.twitter.com/RepLloydDoggett/statuses/1346897950132342787,"Never thought I would be praising Mitch McConnell, but today he defended democracy:""The voters, the courts and the states have all spoken. They've all spoken. If we overrule them it would damage our republic forever. This election actually wasn't unusually close.""",Twitter Web App,office,D,house,Lloyd Doggett,neutral,0.5816790461540222,neutral
1346932503374950402,repmarciafudge,153486399,2021-01-06 21:31:48+00:00,https://www.twitter.com/RepMarciaFudge/statuses/1346932503374950402,My staff and I are safe. Thank you for your concern.,Twitter Web App,office,D,house,Marcia Fudge,gratitude,0.9559598565101624,joy
1346927799261683714,repmarciafudge,153486399,2021-01-06 21:13:06+00:00,https://www.twitter.com/RepMarciaFudge/statuses/1346927799261683714,"This is a sad day in the history of this great nation. This is not the way, even when we disagree. Violence is never the answer and order must be restored. 2/",Twitter Web App,office,D,house,Marcia Fudge,sadness,0.7321962118148804,sadness
1346927798204686336,repmarciafudge,153486399,2021-01-06 21:13:06+00:00,https://www.twitter.com/RepMarciaFudge/statuses/1346927798204686336,This is a day that will live in infamy. The very people who believe they are protecting our democracy have succeeded in destroying it. 1/,Twitter Web App,office,D,house,Marcia Fudge,neutral,0.2643570899963379,neutral
1346958896397754369,rosadelauro,140519774,2021-01-06 23:16:40+00:00,https://www.twitter.com/rosadelauro/statuses/1346958896397754369,My statement on the Trump-instigated coup attempt⤵️,Twitter Web App,office,D,house,Rosa DeLauro,neutral,0.9026488065719604,neutral
1346965236541054976,repteddeutch,137794015,2021-01-06 23:41:52+00:00,https://www.twitter.com/RepTedDeutch/statuses/1346965236541054976,"They stormed the Capitol, the place we work, where so many public servants work to help us represent our constituents—the American people—they stormed that place with weapons. Someone died.Your statement is disconnected from reality. Stop stoking division. Stop spreading hatred. Stop using malicious rhetoric (such as false & reckless charges of “sedition”).Stop showing contempt for the half of the country that disagrees with you.Violence is wrong. We can do better. We are one Nation. #EPluribusUnum",Twitter for iPhone,office,D,house,Ted Deutch,disapproval,0.47121965885162354,anger
1346964847221735430,repteddeutch,137794015,2021-01-06 23:40:19+00:00,https://www.twitter.com/RepTedDeutch/statuses/1346964847221735430,"""Trump has been a disgrace to America, and to the world. Until now, coup attempts were a Latin American and African phenomenon. Now, thanks to Trump, they are part of America’s reality.""",Twitter Web App,office,D,house,Ted Deutch,gratitude,0.6774287223815918,joy
1346961407972057090,repteddeutch,137794015,2021-01-06 23:26:39+00:00,https://www.twitter.com/RepTedDeutch/statuses/1346961407972057090,"Terrible day for our nation. The Capitol attack, people shot, Trump’s dangerous lies & his Hill enablers.Also, a new colleague of mine quoted Hitler at a rally. “Hitler was right on one thing.”👇Never, . Never! Please apologize for this outrageous statement. Here’s the full clip. Incoming Illinois Congresswoman Mary Miller didn’t slip or improvise when she quoted Hitler and praised how the murderous Nazi built his political movement by indoctrinating youth. She was reading from prepared remarks.",Twitter for iPhone,office,D,house,Ted Deutch,sadness,0.24829967319965363,sadness
1346919622369533953,repteddeutch,137794015,2021-01-06 20:40:37+00:00,https://www.twitter.com/RepTedDeutch/statuses/1346919622369533953,This is a violent insurrection. An attempted coup by Trump supporters at his encouragement.They’re attacking the building that represents our democracy and threatening those who work in it.History will remember this dark day as a seditious attack by Americans against America.,Twitter for iPhone,office,D,house,Ted Deutch,neutral,0.3714034855365753,neutral
