id,screen_name,user_id,time,link,text,source,account_type,party,chamber,name,emotion_label,emotion_score,emotion_group
1346946951804309506,repmondaire,1345883634046279681,2021-01-06 22:29:13+00:00,https://www.twitter.com/RepMondaire/statuses/1346946951804309506,"Washington, DC is designed to be one of the most secure places on earth. That pro-Trump terrorists made it to the Speaker’s chair was a choice. Congress must ask who made that choice.",Twitter for iPhone,office,D,house,Mondaire Jones,neutral,0.46541669964790344,neutral
1346945010931965954,repmondaire,1345883634046279681,2021-01-06 22:21:30+00:00,https://www.twitter.com/RepMondaire/statuses/1346945010931965954,What we’ve seen today is beyond the pale. Domestic terrorists descended upon the U.S. Capitol.This is a last gasp for Donald Trump and his Republican co-conspirators in Congress. My statement:,Twitter for iPhone,office,D,house,Mondaire Jones,neutral,0.5148440003395081,neutral
1346931909276946432,repmondaire,1345883634046279681,2021-01-06 21:29:26+00:00,https://www.twitter.com/RepMondaire/statuses/1346931909276946432,I’ll co-sponsor this. Several of my colleagues have violated their oath of office and must be expelled for today’s ongoing violence and insurrection. I believe the Republican members of Congress who have incited this domestic terror attack through their attempts to overturn the election must face consequences. They have broken their sacred Oath of Office. I will be introducing a resolution calling for their expulsion.,Twitter for iPhone,office,D,house,Mondaire Jones,approval,0.5142383575439453,joy
1346927561939562497,repmondaire,1345883634046279681,2021-01-06 21:12:10+00:00,https://www.twitter.com/RepMondaire/statuses/1346927561939562497,"It’s not just the Republican QAnon Caucus. Every objector to today’s certification of Joe Biden’s election is a criminal co-conspirator for whom there must be consequences. Scene at the Capitol makes my blood boil. Lawless thugs attacking the building, while Cruz et al perform a charade for them inside.",Twitter for iPhone,office,D,house,Mondaire Jones,neutral,0.6281651854515076,neutral
1346915322385805322,repmondaire,1345883634046279681,2021-01-06 20:23:31+00:00,https://www.twitter.com/RepMondaire/statuses/1346915322385805322,Donald Trump has incited violence against the legislative branch of the United States Government and must be impeached again.,Twitter for iPhone,office,D,house,Mondaire Jones,anger,0.5004696846008301,anger
1346914429649223680,repmondaire,1345883634046279681,2021-01-06 20:19:59+00:00,https://www.twitter.com/RepMondaire/statuses/1346914429649223680,Thanks to everyone for checking on me. My staff and I are safe.,Twitter for iPhone,office,D,house,Mondaire Jones,gratitude,0.9501020908355713,joy
1346910379587358720,repmondaire,1345883634046279681,2021-01-06 20:03:53+00:00,https://www.twitter.com/RepMondaire/statuses/1346910379587358720,I could not have imagined a darker day for democracy.,Twitter for iPhone,office,D,house,Mondaire Jones,neutral,0.281730592250824,neutral
1346897155466948612,repmondaire,1345883634046279681,2021-01-06 19:11:20+00:00,https://www.twitter.com/RepMondaire/statuses/1346897155466948612,The Trump Administration has been hacked by Russia since January 2017. That changes on January 20th.,Twitter for iPhone,office,D,house,Mondaire Jones,neutral,0.7638934254646301,neutral
1346918200198443019,replaturner,1345850704800468993,2021-01-06 20:34:58+00:00,https://www.twitter.com/RepLaTurner/statuses/1346918200198443019,"The First Amendment guarantees the right of Americans to peacefully assemble, and I will always defend that right. This is un-American and an utter betrayal of that founding principle. This must stop now. #ks02 #ksleg",Twitter Web App,office,R,house,Jacob LaTurner,disapproval,0.3896407186985016,anger
1346918199355338754,replaturner,1345850704800468993,2021-01-06 20:34:57+00:00,https://www.twitter.com/RepLaTurner/statuses/1346918199355338754,"The lawless behavior at the U.S. Capitol is reprehensible and has no place in our country. This is a stain on American history, and I condemn it in the strongest possible terms.",Twitter Web App,office,R,house,Jacob LaTurner,disgust,0.330741822719574,disgust
1346925473767501833,repmann,1345825008887721986,2021-01-06 21:03:52+00:00,https://www.twitter.com/GOPLeader/statuses/1346924765232115712,RT What is unfolding is unacceptable and un-American. It has got to stop.,Twitter for iPhone,office,R,house,Tracey Mann,disapproval,0.7638015747070312,anger
1346918603271106561,repmann,1345825008887721986,2021-01-06 20:36:34+00:00,https://www.twitter.com/RepMann/statuses/1346918603271106561,I am a believer in the First Amendment and the right to peacefully protest. The violence at the Capitol now is unacceptable. My staff and I are safe. Thank you to all law enforcement working to keep the situation contained. Praying for our country.,Twitter for iPhone,office,R,house,Tracey Mann,gratitude,0.896331787109375,joy
1346904028438011906,repmmm,1345807954604412929,2021-01-06 19:38:39+00:00,https://www.twitter.com/RepMMM/statuses/1346904028438011906,You can protest and be peaceful.Storming government buildings and attacking law enforcement officers is unacceptable.My staff and me are safe and sheltering in place. United States Capitol Police saved my life.Attacks on law enforcement officers trying to do their jobs are never acceptable. Period.We can passionately protest without being violent.,Twitter Web App,office,R,house,Mariannette Miller-Meeks,approval,0.47953930497169495,joy
1346962061830610944,repbentz,1345788865911656454,2021-01-06 23:29:15+00:00,https://www.twitter.com/RepBentz/statuses/1346962061830610944,"As debate has been temporarily halted in the electoral process & we follow orders of to shelter in place, I am having many conversations w/ media outlets re: the incidents of today and the electoral certification process. We will resume! #OR02",Twitter for iPhone,office,R,house,Cliff Bentz,neutral,0.8522881865501404,neutral
1346914017332391941,repbentz,1345788865911656454,2021-01-06 20:18:20+00:00,https://www.twitter.com/RepBentz/statuses/1346914017332391941,Peaceful protest is essential to our society. Violent protest is not. I urge all to respect and allow Congress to resume deliberation in the electoral process #OR02,Twitter for iPhone,office,R,house,Cliff Bentz,approval,0.5190878510475159,joy
1346958948914626562,repharshbarger,1345787285179162624,2021-01-06 23:16:53+00:00,https://www.twitter.com/RepHarshbarger/statuses/1346958948914626562,"And to the brave men and women in the Capitol Police who protected us today- God bless you all, and thank you for your service.",Twitter Web App,office,R,house,Diana Harshbarger,gratitude,0.9824494123458862,joy
1346958760800002049,repharshbarger,1345787285179162624,2021-01-06 23:16:08+00:00,https://www.twitter.com/RepHarshbarger/statuses/1346958760800002049,"To my fellow Americans who are frustrated with the election results, we must let the objection process play out peacefully. We must never resort to violence to accomplish our objectives- that is contrary to how we do things in America.",Twitter Web App,office,R,house,Diana Harshbarger,disapproval,0.5825275182723999,anger
1346958382054449153,repharshbarger,1345787285179162624,2021-01-06 23:14:38+00:00,https://www.twitter.com/RepHarshbarger/statuses/1346958382054449153,Every American has the right to peacefully protest. What happened today was unacceptable. Those who broke into the Capitol and attacked our law enforcement should face the full consequences of the law.,Twitter Web App,office,R,house,Diana Harshbarger,disapproval,0.49109160900115967,anger
1346927689538674691,repharshbarger,1345787285179162624,2021-01-06 21:12:40+00:00,https://www.twitter.com/GOPLeader/statuses/1346924765232115712,RT What is unfolding is unacceptable and un-American. It has got to stop.,Twitter for iPhone,office,R,house,Diana Harshbarger,disapproval,0.7638015747070312,anger
1346913075144790018,repharshbarger,1345787285179162624,2021-01-06 20:14:36+00:00,https://www.twitter.com/RepHarshbarger/statuses/1346913075144790018,"As Americans, we are better than the violence occurring today on Capitol Hill. We all have our first amendment right to peacefully protest the certification of election results, and should exercise it when warranted. Violence like this is never acceptable",Twitter for iPhone,office,R,house,Diana Harshbarger,disapproval,0.5889874696731567,anger
1346907317850296321,repbobgood,1345536897838436353,2021-01-06 19:51:43+00:00,https://www.twitter.com/RepBobGood/statuses/1346907317850296321,"Every American has a precious constitutional right to protest. Violence is never the answer. I am calling on everyone, especially Virginians and #VA05 to please protest peacefully. We are thankful for Capitol Police who are courageously doing their jobs to keep everyone safe.",Twitter Web App,office,R,house,Robert Good,gratitude,0.873879611492157,joy
1346952817924329477,repnikema,1345461797361504259,2021-01-06 22:52:31+00:00,https://www.twitter.com/RepNikema/statuses/1346952817924329477,Congratulations to Senators-elect Raphael Warnock and Jon Ossoff! I’m excited to welcome two Senators to Congress who will work with me on behalf of all Georgians.,Twitter Web App,office,D,house,Nikema Williams,excitement,0.8243718147277832,joy
1346915857700691976,repnikema,1345461797361504259,2021-01-06 20:25:39+00:00,https://www.twitter.com/RepNikema/statuses/1346915857700691976,I'm safe. Capitol buildings are on lockdown.,Twitter Web App,office,D,house,Nikema Williams,neutral,0.21789368987083435,neutral
1346902500574699521,repteresalf,1345147845926670337,2021-01-06 19:32:35+00:00,https://www.twitter.com/RepTeresaLF/statuses/1346902500574699521,"We are on lockdown, but safe right now, and firm in our determination to certify the election for the people, by the people.Violent thugs encouraged by a desperate loser won’t get their way.",Twitter for iPhone,office,D,house,Teresa Fernandez,neutral,0.46080121397972107,neutral
1346902938560700416,repfeenstra,1345135363761852416,2021-01-06 19:34:19+00:00,https://www.twitter.com/RepFeenstra/statuses/1346902938560700416,"It's every American's right to protest peacefully. Violence is never the answer. Thank you Capitol Police for working today & every day to keep us safeIf you or someone you know are a part of the protest, please remain peaceful & ask others to do the same. The world is watching",Twitter for Android,office,R,house,Randy Feenstra,gratitude,0.9621841311454773,joy
1346925343727177728,repsarajacobs,1345103905869455361,2021-01-06 21:03:21+00:00,https://www.twitter.com/RepSaraJacobs/statuses/1346925343727177728,My staff and I are safe. The Capitol complex remains on lockdown and everyone should stay clear of the area.,Twitter Web App,office,D,house,Sara Jacobs,caring,0.7405180335044861,moral
1346910744814604292,reprosendale,1344751420139040783,2021-01-06 20:05:20+00:00,https://www.twitter.com/RepRosendale/statuses/1346910744814604292,I am safe and so is my staff. I condemn political violence of any kind. There is a peaceful process to resolve this which is what we were attempting to do. Thank you to the Capitol Police for keeping us safe.,Twitter for iPhone,office,R,house,Matthew Rosendale,gratitude,0.9660354256629944,joy
1346894306771140609,reprosendale,1344751420139040783,2021-01-06 19:00:01+00:00,https://www.twitter.com/RepRosendale/statuses/1346894306771140609,"In another example of her tyranny, tried to limit us to only 11 out of 211 Republican members on the floor while my colleagues and I attempted to fulfill our constitutional duties. Thank you for standing up for us.",Twitter for iPhone,office,R,house,Matthew Rosendale,gratitude,0.971206545829773,joy
1346910852092362752,repmalliotakis,1344750588026900481,2021-01-06 20:05:46+00:00,https://www.twitter.com/RepMalliotakis/statuses/1346910852092362752,My staff & I are safe inside the Capitol complex thanks to the hardworking Capitol Police officers on duty today. I encourage those who are violently protesting to stand down immediately and abide by the law. This is not who we are.,Twitter Web App,office,R,house,Nicole Malliotakis,gratitude,0.9191451072692871,joy
1346953894094659585,repyoungkim,1344677401465397249,2021-01-06 22:56:48+00:00,https://www.twitter.com/RepYoungKim/statuses/1346953894094659585,My family came to the U.S. to achieve the American dream. Now I'm serving as a member of Congress for the community I call home. What we have witnessed today is not who we are.We must condemn this violence & work together to heal our wounds. More unites us than divides us.,Twitter Web App,office,R,house,Young Kim,approval,0.36315008997917175,joy
1346919064690683906,repyoungkim,1344677401465397249,2021-01-06 20:38:24+00:00,https://www.twitter.com/RepYoungKim/statuses/1346919064690683906,"My team & I are safe. Thank you to our law enforcement who are putting their lives on the line.Peaceful protests are a First Amendment right & fundamental to our democracy, but violence is unacceptable. The chaos & violence we're seeing at the Capitol must stop immediately.",Twitter Web App,office,R,house,Young Kim,gratitude,0.7717258334159851,joy
1346920287707664385,repburgessowens,1344481217685692416,2021-01-06 20:43:15+00:00,https://www.twitter.com/RepChrisStewart/statuses/1346920106685771784,"RT Protesters who are breaking windows, threatening violence, and accosting police are behaving inexcusably. It is un-American. This must stop now!",Twitter Web App,office,R,house,Clarence Owens,annoyance,0.39635103940963745,anger
1346915471598120960,repburgessowens,1344481217685692416,2021-01-06 20:24:07+00:00,https://www.twitter.com/RepBurgessOwens/statuses/1346915471598120960,My team and I are safe and beyond grateful for the service of Capitol Police. I am deeply saddened by what is happening right now. Americans are better than this. Senseless violence is NEVER okay. We have to do better.,Twitter Web App,office,R,house,Clarence Owens,sadness,0.5834423899650574,sadness
1346967881142059008,repherrell,1344416719260016641,2021-01-06 23:52:22+00:00,https://www.twitter.com/RepHerrell/statuses/1346967881142059008,The House and Senate will soon resume the people’s business we were sent here to do. We will do our Constitutional duty and be the voice for our constituents. I ask you to pray for us all as we do.,TweetDeck,office,R,house,Stella Herrell,caring,0.8315632343292236,moral
1346967824397463552,repherrell,1344416719260016641,2021-01-06 23:52:09+00:00,https://www.twitter.com/RepHerrell/statuses/1346967824397463552,"The violence at the U.S. Capitol today is reprehensible. I condemn anyone who would endanger our men and women in law enforcement like this in the strongest terms, and I am deeply grateful to the Capitol Police officers who kept me safe today.",TweetDeck,office,R,house,Stella Herrell,gratitude,0.4254419803619385,joy
1346906792031375363,repherrell,1344416719260016641,2021-01-06 19:49:38+00:00,https://www.twitter.com/RepHerrell/statuses/1346906792031375363,"I am safe, but the violence at the Capitol is entirely unacceptable. I urge all those in Washington today to allow Congress to continue its business as the Constitution requires.",Twitter for iPhone,office,R,house,Stella Herrell,disapproval,0.4028242230415344,anger
1346909759358730241,repbowman,1344389506963808264,2021-01-06 20:01:25+00:00,https://www.twitter.com/RepBowman/statuses/1346909759358730241,"Thank you to everyone who has reached out to check in. Myself and my staff are safe and sheltering.What we are seeing right now is fascism, fueled by white supremacy—the logical extension of our failure to reconcile our history.Everyone please stay safe.",Twitter Web App,office,D,house,Jamaal Bowman,gratitude,0.9003918766975403,joy
1346906002533347330,repfischbach,1344375287484723205,2021-01-06 19:46:29+00:00,https://www.twitter.com/RepFischbach/statuses/1346906002533347330,"Respectful disagreement is fundamental to our democracy. The violence that we're seeing, especially toward law enforcement, is unacceptable.",Twitter Web App,office,R,house,Michelle Fischbach,disapproval,0.7031114101409912,anger
1346903635624660994,repfischbach,1344375287484723205,2021-01-06 19:37:05+00:00,https://www.twitter.com/RepFischbach/statuses/1346903635624660994,I plan to vote for the objections to the certification of electoral votes in certain contested states. Read my full statement:,Twitter Web App,office,R,house,Michelle Fischbach,neutral,0.5478988885879517,neutral
1346914131467792386,repgarbarino,1344349650447433729,2021-01-06 20:18:48+00:00,https://www.twitter.com/RepGarbarino/statuses/1346914131467792386,"I am safe and so is my staff. Resorting to violence and disobeying law enforcement is never the answer, no matter which side of the aisle you are on.This is un-American. We are a country of law and order. I'm praying for the soul of our nation.",Twitter Web App,office,R,house,Andrew Garbarino,caring,0.8859319686889648,moral
1346900735422828556,repgarbarino,1344349650447433729,2021-01-06 19:25:34+00:00,https://www.twitter.com/RepGarbarino/statuses/1346900735422828556,Thank you to Capitol Police and our law enforcement officers for working hard to keep us safe in the People's House. I'm praying for their safety.,Twitter Web App,office,R,house,Andrew Garbarino,gratitude,0.9388926029205322,joy
1346966114459271170,repkatcammack,1344325638983987201,2021-01-06 23:45:21+00:00,https://www.twitter.com/RepKatCammack/statuses/1346966114459271170,"My full statement on the abhorrent events at the Capitol is below. I am irate. I am heartbroken. My message is simple. Violence will not be tolerated. If you attack the Capitol, you attack this country.",Twitter for iPhone,office,R,house,Katherine Cammack,sadness,0.7076027393341064,sadness
1346937903201574912,repkatcammack,1344325638983987201,2021-01-06 21:53:15+00:00,https://www.twitter.com/RepKatCammack/statuses/1346937903201574912,Today's reckless events are un-American and violence is never acceptable. This country was established on the rule of law and this is not the way to voice objections to our electoral process. Please pray for our country.,Twitter Web App,office,R,house,Katherine Cammack,caring,0.7360612154006958,moral
1346914975412088839,repkatcammack,1344325638983987201,2021-01-06 20:22:09+00:00,https://www.twitter.com/freedomcaucus/statuses/1346911310139727873,RT There is a difference between peaceful protests and mob violence. We unequivocally condemn the violence going on in Capitol building right now. This must end and must end NOW. Thank God for the Capitol Police and for our law enforcement personnel.,Twitter Web App,office,R,house,Katherine Cammack,gratitude,0.8363673090934753,joy
1346906512904613894,repkatcammack,1344325638983987201,2021-01-06 19:48:31+00:00,https://www.twitter.com/RepKatCammack/statuses/1346906512904613894,Protesters have broken into the Capitol Building. My colleagues and I are safe and following the instructions of Capitol Police and security authorities.,Twitter Web App,office,R,house,Katherine Cammack,neutral,0.34980034828186035,neutral
1346900081371467779,repkatcammack,1344325638983987201,2021-01-06 19:22:58+00:00,https://www.twitter.com/RepKatCammack/statuses/1346900081371467779,"Everyone outside the U.S. Capitol Building needs to calm down. We are a Republic of laws, but attacking our law enforcement is not an example of peaceful assembly.",Twitter Web App,office,R,house,Katherine Cammack,neutral,0.6163788437843323,neutral
1346927270993256453,replisamcclain,1344032292432437248,2021-01-06 21:11:00+00:00,https://www.twitter.com/RepLisaMcClain/statuses/1346927270993256453,"To be clear, patriots is another word for law enforcement - those who risk their safety for the greater good.These attacks on our nation’s Capitol must stop. This is beneath America.",Twitter for iPhone,office,R,house,Lisa McClain,disapproval,0.38239195942878723,anger
1346908970129231872,replisamcclain,1344032292432437248,2021-01-06 19:58:17+00:00,https://www.twitter.com/RepLisaMcClain/statuses/1346908970129231872,The work to keep ALL Americans safe. Attacks on these patriots are never justified. I will continue to listen to law enforcement that are protecting those in the Capitol and thank all who have reached out with concerns.,Twitter for iPhone,office,R,house,Lisa McClain,gratitude,0.9434933662414551,joy
1346943949085306883,repcawthorn,1344007696555663360,2021-01-06 22:17:17+00:00,https://www.twitter.com/RepCawthorn/statuses/1346943949085306883,I strongly condemn all acts of violence and urge protestors to only engage in PEACEFUL protests. The storming of the Capitol today was a reprehensible act and unacceptable in this country. Pray for our country.,Twitter for iPhone,office,R,house,David Cawthorn,caring,0.33940351009368896,moral
1346919529448960002,repcawthorn,1344007696555663360,2021-01-06 20:40:15+00:00,https://www.twitter.com/RepCawthorn/statuses/1346919529448960002,"The battle for election integrity must occur on the house floor, not in the streets of D.C.",Twitter for iPhone,office,R,house,David Cawthorn,neutral,0.5697121620178223,neutral
1346913059890208769,repsteel,1343740146630451200,2021-01-06 20:14:32+00:00,https://www.twitter.com/RepSteel/statuses/1346913059890208769,"Violence is never, ever the answer. As Americans we are blessed with the right to make our voices heard in support of our democracy, but turning to violence is always wrong. I am praying for the Capitol Police today, and am thankful for their work to keep us safe.",Twitter Web App,office,R,house,Michelle Steel,gratitude,0.6707937717437744,joy
1346920060737216515,repcarlos,1343679195034103808,2021-01-06 20:42:21+00:00,https://www.twitter.com/RepCarlos/statuses/1346920060737216515,Mr. President please take a firm stance and help us restore order in the Capitol. This is unacceptable and dangerous. Capitol Police needs additional officers and resources now. We need you to urgently call on these protestors to disperse.,Twitter for iPhone,office,R,house,Carlos Gimenez,caring,0.21790045499801636,moral
1346919730641334273,repcarlos,1343679195034103808,2021-01-06 20:41:03+00:00,https://www.twitter.com/RepCarlos/statuses/1346919730641334273,Esta anarquía es aborrecible. Esto no nos representa como nación o nuestros valores. Todos los que participan en actos de violencia deben ser detenidos y castigados. Rezo por la seguridad de la Policía del Capitolio que trabaja para garantizar la seguridad de todos.,Twitter for iPhone,office,R,house,Carlos Gimenez,disapproval,0.43970826268196106,anger
1346911516474265602,repcarlos,1343679195034103808,2021-01-06 20:08:24+00:00,https://www.twitter.com/RepCarlos/statuses/1346911516474265602,This lawlessness is abhorrent and disgusting. This is not who we are as a nation and does not represent our values. All engaging in violence must be apprehended and punished. I pray for the safety of our Capitol Police who are working tirelessly to ensure everyone is kept safe.,Twitter for iPhone,office,R,house,Carlos Gimenez,caring,0.4327276051044464,moral
1346959185259409409,repfranklin,1343664721384398849,2021-01-06 23:17:49+00:00,https://www.twitter.com/RepFranklin/statuses/1346959185259409409,It is un-American and counter to everything that has made our country a shining city on a hill for the past 244 years. We will not be goaded into any course of action under threat by anarchists.,Twitter Web App,office,R,house,Scott Franklin,disapproval,0.7042644023895264,anger
1346959184563200001,repfranklin,1343664721384398849,2021-01-06 23:17:49+00:00,https://www.twitter.com/RepFranklin/statuses/1346959184563200001,"Today will go down as a very dark day in America’s history. Make no mistake, the violence demonstrated in the Capitol today is inexcusable and cannot be tolerated.",Twitter Web App,office,R,house,Scott Franklin,disapproval,0.4124488830566406,anger
1346954171283628033,repmarymiller,1343656635907125250,2021-01-06 22:57:54+00:00,https://www.twitter.com/Jim_Jordan/statuses/1346952368190083072,"RT Americans support peaceful protests, First Amendment activity, and the men and women of law enforcement. What happened today is wrong and is not what America is about.",Twitter Web App,office,R,house,Mary Miller,disapproval,0.7188150882720947,anger
1346944440816922627,repmarymiller,1343656635907125250,2021-01-06 22:19:14+00:00,https://www.twitter.com/RepMaryMiller/statuses/1346944440816922627,"Pray for our Capitol Police, our law enforcement personnel, and our nation. Violence is not who we are.",Twitter Web App,office,R,house,Mary Miller,caring,0.8681656718254089,moral
1346944329378451456,repmarymiller,1343656635907125250,2021-01-06 22:18:47+00:00,https://www.twitter.com/RepMaryMiller/statuses/1346944329378451456,"We are a nation of laws and while we shall defend our right to peacefully disagree, violence is unacceptable.",Twitter Web App,office,R,house,Mary Miller,disapproval,0.6573385000228882,anger
1346944277889372162,repmarymiller,1343656635907125250,2021-01-06 22:18:35+00:00,https://www.twitter.com/RepMaryMiller/statuses/1346944277889372162,Congresswoman Miller's statement was a denunciation of evil dictators' efforts to re-educate young people and similar efforts by left-wing radicals in our country today.,Twitter Web App,office,R,house,Mary Miller,neutral,0.8512479662895203,neutral
1346914603381489670,repmarymiller,1343656635907125250,2021-01-06 20:20:40+00:00,https://www.twitter.com/freedomcaucus/statuses/1346911310139727873,RT There is a difference between peaceful protests and mob violence. We unequivocally condemn the violence going on in Capitol building right now. This must end and must end NOW. Thank God for the Capitol Police and for our law enforcement personnel.,Twitter Web App,office,R,house,Mary Miller,gratitude,0.8363673090934753,joy
